{
  "schema_version": 1,
  "index_version": "v2026.08.28-2ee090",
  "generated_at": "2026-08-28T07:55:16Z",
  "min_dashboard_version": "0.1.0",
  "apps": [
    {
      "slug": "ai",
      "title": "Local AI (Ollama + Open-WebUI)",
      "description": "Local LLM inference via Ollama with Open-WebUI as the chat front-end.\nRuns on CPU by default; opt-in NVIDIA GPU passthrough via the 'gpu'\ncompose profile (requires the gpu-nvidia host role, TBD).",
      "category": "ai",
      "images": [
        {
          "ref": "ollama/ollama:latest",
          "digest": null
        },
        {
          "ref": "ghcr.io/open-webui/open-webui:main",
          "digest": null
        }
      ],
      "unpinned": true,
      "icon": "ollama",
      "source_url": "https://github.com/ollama/ollama",
      "homepage_url": "https://ollama.com",
      "depends_on": [
        "core"
      ],
      "requires": {
        "min_ram_mb": 8192,
        "min_disk_gb": 30,
        "host_roles": [],
        "start_budget_seconds": 240
      },
      "compose": "# aurora.local / packages/ai\n#\n# Ollama (local LLM runner) + Open-WebUI (chat frontend).\n#\n# CPU is the default. NVIDIA GPU passthrough is opt-in via the 'gpu'\n# compose profile:\n#   ./scripts/up.sh --gpu core ai\n#\n# The two ollama variants use distinct container names; both register\n# the `ollama` network alias on aurora_net so Open-WebUI always resolves\n# it. Run ONE at a time (see README).\n\nname: aurora-ai\n\nnetworks:\n  aurora_net:\n    external: true\n\nservices:\n  # CPU inference (default). Runs unless --gpu is passed to up.sh, which\n  # switches on the 'gpu' profile and drops 'cpu' so only one Ollama\n  # binds :11434.\n  ollama-cpu:\n    image: ollama/ollama:latest\n    container_name: ollama-cpu\n    hostname: ollama\n    restart: unless-stopped\n    profiles: [\"cpu\"]\n    networks:\n      aurora_net:\n        aliases: [ollama]\n    environment:\n      - TZ=${TZ:-Europe/London}\n      - OLLAMA_KEEP_ALIVE=${OLLAMA_KEEP_ALIVE:-5m}\n    volumes:\n      - ../../data/ai/ollama:/root/.ollama\n    ports:\n      - \"11434:11434\"\n\n  ollama-gpu:\n    image: ollama/ollama:latest\n    container_name: ollama-gpu\n    hostname: ollama\n    restart: unless-stopped\n    profiles: [\"gpu\"]\n    networks:\n      aurora_net:\n        aliases: [ollama]\n    environment:\n      - TZ=${TZ:-Europe/London}\n      - OLLAMA_KEEP_ALIVE=${OLLAMA_KEEP_ALIVE:-5m}\n    volumes:\n      - ../../data/ai/ollama:/root/.ollama\n    ports:\n      - \"11434:11434\"\n    deploy:\n      resources:\n        reservations:\n          devices:\n            - driver: nvidia\n              count: all\n              capabilities: [gpu]\n\n  open-webui:\n    image: ghcr.io/open-webui/open-webui:main\n    container_name: open-webui\n    restart: unless-stopped\n    networks: [aurora_net]\n    environment:\n      - TZ=${TZ:-Europe/London}\n      - OLLAMA_BASE_URL=http://ollama:11434\n      - WEBUI_SECRET_KEY=${WEBUI_SECRET_KEY}\n      - DEFAULT_MODELS=${DEFAULT_MODELS:-}\n    volumes:\n      - ../../data/ai/open-webui:/app/backend/data\n    ports:\n      - \"3011:8080\"\n",
      "env_example": "# aurora.local / packages/ai / .env.example\n#\n# Copy to .env and fill in.\n\nTZ=Europe/London\n\n# ---- Ollama ----\n# How long to keep a loaded model warm in RAM/VRAM between requests.\n# Increase for a \"chat\" workflow, decrease to free memory faster.\nOLLAMA_KEEP_ALIVE=5m\n\n# ---- Open-WebUI ----\n# Signing key for session tokens. Any long random string.\n#   openssl rand -hex 32\nWEBUI_SECRET_KEY=\n\n# Comma-separated list of models to preselect in the UI dropdown.\n# Models still have to be pulled first (`ollama pull <name>`).\n#   e.g. llama3.2,qwen2.5-coder:7b,mistral-nemo\nDEFAULT_MODELS=\n",
      "caddy_snippet": "# packages/ai — Caddy vhost\n# Import from packages/core/caddy/Caddyfile.\n\nhttp://ai.{$DOMAIN} {\n\treverse_proxy open-webui:8080\n}\n\nhttps://ai.{$DOMAIN} {\n\ttls internal\n\t# Open-WebUI uses websockets for streaming responses.\n\treverse_proxy open-webui:8080 {\n\t\theader_up X-Real-IP {remote_host}\n\t\theader_up X-Forwarded-For {remote_host}\n\t\theader_up X-Forwarded-Proto {scheme}\n\t}\n}\n\n# Optional direct-to-ollama vhost (raw API).\nhttp://ollama.{$DOMAIN} {\n\treverse_proxy ollama:11434\n}\nhttps://ollama.{$DOMAIN} {\n\ttls internal\n\treverse_proxy ollama:11434\n}\n",
      "readme": "# ai\n\nLocal LLM inference: **Ollama** (model runtime) + **Open-WebUI** (chat\nfrontend).\n\n## First-run\n\n1. Copy `.env.example` to `.env`. Set `WEBUI_SECRET_KEY` (generate with\n   `openssl rand -hex 32`).\n2. `./scripts/up.sh core ai`\n3. Open-WebUI: `https://ai.$DOMAIN/` — first user to sign up\n   becomes the admin.\n4. Pull a model:\n   ```\n   docker exec -it ollama-cpu ollama pull llama3.2\n   docker exec -it ollama-cpu ollama pull qwen2.5-coder:7b\n   ```\n   (For GPU: replace `ollama-cpu` with `ollama-gpu`.)\n\n## RAM / VRAM guidance\n\nQuantised (Q4) models, rough rule of thumb:\n\n| Model size | Fits in            | Typical use                 |\n|------------|--------------------|-----------------------------|\n| 1B–3B      | ~4 GB              | quick chat, embeddings      |\n| 7B–8B      | ~8 GB              | coding assist (qwen-coder)  |\n| 13B        | ~16 GB             | general chat, higher quality|\n| 32B–34B    | ~24 GB             | high quality reasoning      |\n| 70B        | ~48 GB (GPU only)  | best quality, needs 2× 3090 |\n\nCPU inference is fine for 1B–8B on a modern desktop; expect 5–20 tok/s.\nGPU is 5–20× faster.\n\n## GPU passthrough (opt-in)\n\nThe `gpu` compose profile brings up an `ollama-gpu` container that\nreserves all NVIDIA GPUs on the host.\n\n**Prerequisites (host):**\n- NVIDIA driver installed\n- NVIDIA Container Toolkit installed and Docker restarted:\n  `sudo apt install nvidia-container-toolkit && sudo systemctl restart docker`\n\n**Enabling:**\n```\ndocker stop ollama-cpu   # only one ollama can bind :11434\n./scripts/up.sh --gpu core ai\n```\n\nBoth variants share the `../../data/ai/ollama` volume so pulled models\ncarry over. Both register `ollama` as a network alias, so Open-WebUI's\n`OLLAMA_BASE_URL=http://ollama:11434` works unchanged.\n\n**Note:** The `gpu-nvidia` host role referenced in `manifest.yml` does\nnot yet exist in `host/roles/`. Until it does, install the NVIDIA\nContainer Toolkit manually.\n\n## Ports\n\nSee `manifest.yml`.\n"
    },
    {
      "slug": "backup",
      "title": "Backup (Kopia)",
      "description": "Kopia is a deduplicating, encrypted backup tool with a friendly web\nUI. Defaults to a local filesystem repository under\ndata/backup/repository; can be reconfigured to point at B2, S3, GCS,\nAzure, SFTP or WebDAV from the UI without changing this package.",
      "category": "backup",
      "images": [
        {
          "ref": "kopia/kopia:latest",
          "digest": null
        }
      ],
      "unpinned": true,
      "icon": "kopia",
      "source_url": "https://github.com/kopia/kopia",
      "homepage_url": "https://kopia.io",
      "depends_on": [
        "core"
      ],
      "requires": {
        "min_ram_mb": 512,
        "min_disk_gb": 20,
        "host_roles": []
      },
      "compose": "# aurora.local / packages/backup\n#\n# Kopia is a repository-based deduplicating backup tool with a decent\n# web UI. Runs in \"server\" mode; you connect to it via the browser and\n# drive snapshots from there, or shell in and use the `kopia` CLI.\n#\n# Two bind mounts to be aware of:\n#   /data       -> host / (read-only). Kopia never writes here.\n#   /repository -> data/backup/repository. Local filesystem repo by\n#                  default. To back up to B2/S3 instead, leave this\n#                  unused and reconfigure the repo from inside the UI\n#                  (or via `kopia repository create s3 ...`).\n\nname: aurora-backup\n\nnetworks:\n  aurora_net:\n    external: true\n\nservices:\n  kopia:\n    image: kopia/kopia:latest\n    container_name: kopia\n    hostname: kopia\n    restart: unless-stopped\n    networks: [aurora_net]\n    # Kopia's server mode. Bind to 0.0.0.0 inside the container; Caddy\n    # (or a LAN port) does the exposure. Basic auth is set via\n    # KOPIA_UI_USER/PASSWORD env vars. --without-password used to sit in\n    # this list and kopia rejected the whole config with \"listen address\n    # not allowed for insecure server without password\" — that flag\n    # disables the SERVER-side basic auth we just configured on the two\n    # lines above, and kopia refuses to publish an unauthenticated HTTP\n    # API on anything other than loopback. Removed 2026-08-27 during the\n    # QA-sweep fixes.\n    command:\n      - server\n      - start\n      - --insecure\n      - --address=0.0.0.0:51515\n      - --server-username=${KOPIA_UI_USER:-admin}\n      - --server-password=${KOPIA_UI_PASSWORD:-changeme}\n      - --ui\n    environment:\n      - TZ=${TZ:-Europe/London}\n      # Consumed by kopia CLI on first `repository create` / `connect`.\n      - KOPIA_PASSWORD=${KOPIA_PASSWORD:-}\n      # Optional remote repo hints — see .env.example.\n      - KOPIA_REPOSITORY=${KOPIA_REPOSITORY:-}\n    volumes:\n      # Persistent kopia server + client config.\n      - ../../data/backup/kopia:/app/config\n      - ../../data/backup/cache:/app/cache\n      - ../../data/backup/logs:/app/logs\n      # Local filesystem repository (default). If you switch to B2/S3\n      # you can leave this mounted; it just won't be used.\n      - ../../data/backup/repository:/repository\n      # Everything Kopia is allowed to snapshot from. Read-only for\n      # safety — Kopia is a backup tool, it should never mutate host\n      # files. Exclude patterns live in policies/default-policy.json.\n      - /:/data:ro\n    ports:\n      - \"51515:51515\"\n",